CREATE TABLE t1 (id INT PRIMARY KEY, val COMPLEX, description VARCHAR(100));
INSERT INTO t1 VALUES
(1, '(1,2)', 'First'),
(2, '(3,4)', 'Second'),
(3, '(5,6)', 'Third');
CREATE VIEW v1 AS
SELECT id, val, description FROM t1;
SELECT COUNT(*) AS initial_count FROM v1;
initial_count
3
DELETE FROM v1 WHERE id = 2;
SELECT COUNT(*) AS final_count FROM v1;
final_count
2
SELECT COUNT(*) FROM t1 WHERE id = 2;
COUNT(*)
0
DROP VIEW v1;
DROP TABLE t1;
