CREATE TABLE t1 (
id INT PRIMARY KEY,
val COMPLEX
);
INSERT INTO t1 VALUES
(1, '(1.0,2.0)'),
(2, '(0,0)'),
(3, '(-3.5,4.5)'),
(4, '(-0,0)'),
(5, '(5.0,-6.0)'),
(6, '(0,-0)'),
(7, '(-7.5,-8.5)'),
(8, '(-0,-0)'),
(9, '(9.0,10.0)'),
(10, '(0,0)');
UPDATE t1 SET val = '(100.0,200.0)' WHERE id = 1;
SELECT * FROM t1 ORDER BY id;
id	val
1	(100,200)
2	(0,0)
3	(-3.5,4.5)
4	(0,0)
5	(5,-6)
6	(0,0)
7	(-7.5,-8.5)
8	(0,0)
9	(9,10)
10	(0,0)
UPDATE t1 SET val = '(11.0,12.0)' WHERE id = 2;
SELECT * FROM t1 ORDER BY id;
id	val
1	(100,200)
2	(11,12)
3	(-3.5,4.5)
4	(0,0)
5	(5,-6)
6	(0,0)
7	(-7.5,-8.5)
8	(0,0)
9	(9,10)
10	(0,0)
UPDATE t1 SET val = '(99.0,99.0)' WHERE id IN (3, 5, 7);
SELECT * FROM t1 ORDER BY id;
id	val
1	(100,200)
2	(11,12)
3	(99,99)
4	(0,0)
5	(99,99)
6	(0,0)
7	(99,99)
8	(0,0)
9	(9,10)
10	(0,0)
UPDATE t1 SET val = '(-50.0,-60.0)' WHERE id = 9;
SELECT * FROM t1 ORDER BY id;
id	val
1	(100,200)
2	(11,12)
3	(99,99)
4	(0,0)
5	(99,99)
6	(0,0)
7	(99,99)
8	(0,0)
9	(-50,-60)
10	(0,0)
UPDATE t1 SET val = '(88.0,88.0)' WHERE val = '(0,0)';
SELECT * FROM t1 ORDER BY id;
id	val
1	(100,200)
2	(11,12)
3	(99,99)
4	(88,88)
5	(99,99)
6	(88,88)
7	(99,99)
8	(88,88)
9	(-50,-60)
10	(88,88)
DROP TABLE t1;
