CREATE TABLE t1 (
id INT PRIMARY KEY,
val COMPLEX,
name VARCHAR(50)
);
INSERT INTO t1 VALUES
(1, '(1.0,2.0)', 'one'),
(2, '(0,0)', 'two'),
(3, '(-3.5,4.5)', 'three'),
(4, '(-0,0)', 'four'),
(5, '(5.0,-6.0)', 'five'),
(6, '(0,-0)', 'six'),
(7, '(-7.5,-8.5)', 'seven'),
(8, '(-0,-0)', 'eight'),
(9, '(9.0,10.0)', 'nine'),
(10, '(0,0)', 'ten');
UPDATE t1 SET val = '(100.0,200.0)', name = 'updated' WHERE id = 1;
SELECT * FROM t1 ORDER BY id;
id	val	name
1	(100,200)	updated
2	(0,0)	two
3	(-3.5,4.5)	three
4	(0,0)	four
5	(5,-6)	five
6	(0,0)	six
7	(-7.5,-8.5)	seven
8	(0,0)	eight
9	(9,10)	nine
10	(0,0)	ten
UPDATE t1 SET val = '(50.0,60.0)', name = 'changed' WHERE id IN (2, 4, 6);
SELECT * FROM t1 ORDER BY id;
id	val	name
1	(100,200)	updated
2	(50,60)	changed
3	(-3.5,4.5)	three
4	(50,60)	changed
5	(5,-6)	five
6	(50,60)	changed
7	(-7.5,-8.5)	seven
8	(0,0)	eight
9	(9,10)	nine
10	(0,0)	ten
UPDATE t1 SET name = 'zero-variant' WHERE val = '(0,0)';
SELECT * FROM t1 ORDER BY id;
id	val	name
1	(100,200)	updated
2	(50,60)	changed
3	(-3.5,4.5)	three
4	(50,60)	changed
5	(5,-6)	five
6	(50,60)	changed
7	(-7.5,-8.5)	seven
8	(0,0)	zero-variant
9	(9,10)	nine
10	(0,0)	zero-variant
UPDATE t1 SET val = NULL, name = NULL WHERE id = 9;
SELECT * FROM t1 ORDER BY id;
id	val	name
1	(100,200)	updated
2	(50,60)	changed
3	(-3.5,4.5)	three
4	(50,60)	changed
5	(5,-6)	five
6	(50,60)	changed
7	(-7.5,-8.5)	seven
8	(0,0)	zero-variant
9	NULL	NULL
10	(0,0)	zero-variant
DROP TABLE t1;
