CREATE TABLE t1 (
id INT PRIMARY KEY,
val COMPLEX
);
INSERT INTO t1 VALUES
(1, '(-20.0,0.0)'),
(2, '(-10.0,-10.0)'),
(3, '(-5.0,5.0)'),
(4, '(0,0)'),
(5, '(5.0,-5.0)'),
(6, '(10.0,0.0)'),
(7, '(10.0,10.0)'),
(8, '(20.0,0.0)'),
(9, '(1.0,2.0)'),
(10, '(1.0,2.0)');
UPDATE t1 SET val = '(99.0,99.0)' WHERE val != '(1.0,2.0)';
SELECT * FROM t1 ORDER BY id;
id	val
1	(99,99)
2	(99,99)
3	(99,99)
4	(99,99)
5	(99,99)
6	(99,99)
7	(99,99)
8	(99,99)
9	(1,2)
10	(1,2)
UPDATE t1 SET val = '(-100.0,-100.0)' WHERE val < '(50.0,50.0)';
SELECT * FROM t1 ORDER BY id;
id	val
1	(99,99)
2	(99,99)
3	(99,99)
4	(99,99)
5	(99,99)
6	(99,99)
7	(99,99)
8	(99,99)
9	(-100,-100)
10	(-100,-100)
UPDATE t1 SET val = '(100.0,100.0)' WHERE val > '(50.0,50.0)';
SELECT * FROM t1 ORDER BY id;
id	val
1	(100,100)
2	(100,100)
3	(100,100)
4	(100,100)
5	(100,100)
6	(100,100)
7	(100,100)
8	(100,100)
9	(-100,-100)
10	(-100,-100)
UPDATE t1 SET val = '(-200.0,-200.0)' WHERE val <= '(-100.0,-100.0)';
SELECT * FROM t1 ORDER BY id;
id	val
1	(100,100)
2	(100,100)
3	(100,100)
4	(100,100)
5	(100,100)
6	(100,100)
7	(100,100)
8	(100,100)
9	(-200,-200)
10	(-200,-200)
UPDATE t1 SET val = '(200.0,200.0)' WHERE val >= '(100.0,100.0)';
SELECT * FROM t1 ORDER BY id;
id	val
1	(200,200)
2	(200,200)
3	(200,200)
4	(200,200)
5	(200,200)
6	(200,200)
7	(200,200)
8	(200,200)
9	(-200,-200)
10	(-200,-200)
UPDATE t1 SET val = '(88.0,88.0)' WHERE val BETWEEN '(-250.0,-250.0)' AND '(-150.0,-150.0)';
SELECT * FROM t1 ORDER BY id;
id	val
1	(200,200)
2	(200,200)
3	(200,200)
4	(200,200)
5	(200,200)
6	(200,200)
7	(200,200)
8	(200,200)
9	(88,88)
10	(88,88)
DROP TABLE t1;
