CREATE TABLE t1 (
id INT PRIMARY KEY,
val COMPLEX
);
INSERT INTO t1 VALUES
(1, '(1.0,2.0)'),
(2, '(0,0)'),
(3, '(1.0,2.0)'),
(4, '(-0,0)'),
(5, '(5.0,-6.0)'),
(6, '(0,-0)'),
(7, '(1.0,2.0)'),
(8, '(-0,-0)'),
(9, '(5.0,-6.0)'),
(10, '(0,0)');
UPDATE t1 SET val = '(100.0,100.0)' WHERE val = '(1.0,2.0)';
SELECT * FROM t1 ORDER BY id;
id	val
1	(100,100)
2	(0,0)
3	(100,100)
4	(0,0)
5	(5,-6)
6	(0,0)
7	(100,100)
8	(0,0)
9	(5,-6)
10	(0,0)
UPDATE t1 SET val = '(200.0,200.0)' WHERE val = '(0,0)';
SELECT * FROM t1 ORDER BY id;
id	val
1	(100,100)
2	(200,200)
3	(100,100)
4	(200,200)
5	(5,-6)
6	(200,200)
7	(100,100)
8	(200,200)
9	(5,-6)
10	(200,200)
UPDATE t1 SET val = '(300.0,300.0)' WHERE val = '(5.0,-6.0)';
SELECT * FROM t1 ORDER BY id;
id	val
1	(100,100)
2	(200,200)
3	(100,100)
4	(200,200)
5	(300,300)
6	(200,200)
7	(100,100)
8	(200,200)
9	(300,300)
10	(200,200)
DROP TABLE t1;
