CREATE TABLE t1 (
id INT PRIMARY KEY,
val COMPLEX
);
INSERT INTO t1 VALUES
(1, '(1e10,2e10)'),
(2, '(1.5e-10,-2.5e-10)'),
(3, '(1e100,-1e100)'),
(4, '(0,0)');
UPDATE t1 SET val = '(100.0,200.0)' WHERE id = 1;
SELECT * FROM t1 ORDER BY id;
id	val
1	(100,200)
2	(1.5e-10,-2.5e-10)
3	(1e+100,-1e+100)
4	(0,0)
UPDATE t1 SET val = '(3e20,4e20)' WHERE id = 4;
SELECT * FROM t1 ORDER BY id;
id	val
1	(100,200)
2	(1.5e-10,-2.5e-10)
3	(1e+100,-1e+100)
4	(3e+20,4e+20)
INSERT INTO t1 VALUES
(5, '(1.0,2.0)'),
(6, '( 3.0 , 4.0 )'),
(7, '(  5.0  ,  6.0  )');
UPDATE t1 SET val = '( 10.0 , 20.0 )' WHERE id = 5;
UPDATE t1 SET val = '(30.0,40.0)' WHERE id = 6;
UPDATE t1 SET val = '(  50.0  ,  60.0  )' WHERE id = 7;
SELECT * FROM t1 ORDER BY id;
id	val
1	(100,200)
2	(1.5e-10,-2.5e-10)
3	(1e+100,-1e+100)
4	(3e+20,4e+20)
5	(10,20)
6	(30,40)
7	(50,60)
UPDATE t1 SET val = '(100.0,100.0)' WHERE val = '(999.0,999.0)';
SELECT * FROM t1 WHERE id IN (5, 6, 7) ORDER BY id;
id	val
5	(10,20)
6	(30,40)
7	(50,60)
INSERT INTO t1 VALUES
(11, '(0,0)'),
(12, '(-0,0)'),
(13, '(0,-0)'),
(14, '(-0,-0)');
UPDATE t1 SET val = '(100.0,100.0)' WHERE val = '(0,0)';
SELECT * FROM t1 WHERE id >= 11 ORDER BY id;
id	val
11	(100,100)
12	(100,100)
13	(100,100)
14	(100,100)
UPDATE t1 SET val = '(-0,-0)' WHERE id IN (11, 12);
UPDATE t1 SET val = '(0,-0)' WHERE id = 13;
SELECT * FROM t1 WHERE id >= 11 ORDER BY id;
id	val
11	(0,0)
12	(0,0)
13	(0,0)
14	(100,100)
INSERT INTO t1 VALUES
(21, NULL),
(22, '(1.0,2.0)'),
(23, NULL);
UPDATE t1 SET val = '(100.0,100.0)' WHERE val = NULL;
SELECT * FROM t1 WHERE id >= 21 ORDER BY id;
id	val
21	NULL
22	(1,2)
23	NULL
UPDATE t1 SET val = '(200.0,200.0)' WHERE val IS NULL;
SELECT * FROM t1 WHERE id >= 21 ORDER BY id;
id	val
21	(200,200)
22	(1,2)
23	(200,200)
UPDATE t1 SET val = NULL WHERE id = 21;
UPDATE t1 SET val = '(300.0,300.0)' WHERE val IS NULL AND id > 22;
SELECT * FROM t1 WHERE id >= 21 ORDER BY id;
id	val
21	NULL
22	(1,2)
23	(200,200)
DROP TABLE t1;
