CREATE TABLE t1 (
id INT PRIMARY KEY,
val COMPLEX
);
INSERT INTO t1 VALUES
(1, '(1.0,2.0)'),
(2, '(0,0)'),
(3, '(-3.5,4.5)'),
(4, '(-0,0)'),
(5, '(5.0,-6.0)'),
(6, '(0,-0)'),
(7, '(-7.5,-8.5)'),
(8, '(-0,-0)'),
(9, '(9.0,10.0)'),
(10, '(0,0)');
UPDATE t1 SET val = '(100.0,200.0)' WHERE id = 2;
SELECT * FROM t1 ORDER BY id;
id	val
1	(1,2)
2	(100,200)
3	(-3.5,4.5)
4	(0,0)
5	(5,-6)
6	(0,0)
7	(-7.5,-8.5)
8	(0,0)
9	(9,10)
10	(0,0)
UPDATE t1 SET val = '(50.0,60.0)' WHERE id > 8;
SELECT * FROM t1 ORDER BY id;
id	val
1	(1,2)
2	(100,200)
3	(-3.5,4.5)
4	(0,0)
5	(5,-6)
6	(0,0)
7	(-7.5,-8.5)
8	(0,0)
9	(50,60)
10	(50,60)
UPDATE t1 SET val = '(-99.0,-99.0)' WHERE id BETWEEN 4 AND 6;
SELECT * FROM t1 ORDER BY id;
id	val
1	(1,2)
2	(100,200)
3	(-3.5,4.5)
4	(-99,-99)
5	(-99,-99)
6	(-99,-99)
7	(-7.5,-8.5)
8	(0,0)
9	(50,60)
10	(50,60)
UPDATE t1 SET val = '(77.0,88.0)' WHERE id IN (1, 3, 7);
SELECT * FROM t1 ORDER BY id;
id	val
1	(77,88)
2	(100,200)
3	(77,88)
4	(-99,-99)
5	(-99,-99)
6	(-99,-99)
7	(77,88)
8	(0,0)
9	(50,60)
10	(50,60)
DROP TABLE t1;
