CREATE TABLE t1 (
id INT PRIMARY KEY,
val COMPLEX
);
INSERT INTO t1 VALUES
(1, '(1.0,2.0)'),
(2, '(0,0)'),
(3, '(-3.5,4.5)'),
(4, '(-0,0)'),
(5, '(5.0,-6.0)'),
(6, '(0,-0)'),
(7, '(-7.5,-8.5)'),
(8, '(-0,-0)'),
(9, '(9.0,10.0)'),
(10, '(0,0)');
UPDATE LOW_PRIORITY t1 SET val = '(100.0,200.0)' WHERE id = 1;
SELECT * FROM t1 ORDER BY id;
id	val
1	(100,200)
2	(0,0)
3	(-3.5,4.5)
4	(0,0)
5	(5,-6)
6	(0,0)
7	(-7.5,-8.5)
8	(0,0)
9	(9,10)
10	(0,0)
UPDATE LOW_PRIORITY t1 SET val = '(50.0,60.0)' WHERE id IN (2, 4, 6, 8);
SELECT * FROM t1 ORDER BY id;
id	val
1	(100,200)
2	(50,60)
3	(-3.5,4.5)
4	(50,60)
5	(5,-6)
6	(50,60)
7	(-7.5,-8.5)
8	(50,60)
9	(9,10)
10	(0,0)
DROP TABLE t1;
