CREATE TABLE t1 (
id INT PRIMARY KEY,
val COMPLEX
);
INSERT INTO t1 VALUES
(1, '(1.0,2.0)'),
(2, NULL),
(3, '(-3.5,4.5)'),
(4, '(-0,0)'),
(5, '(5.0,-6.0)'),
(6, NULL),
(7, '(-7.5,-8.5)'),
(8, '(0,0)'),
(9, '(9.0,10.0)'),
(10, '(0,-0)');
UPDATE t1 SET val = NULL WHERE id = 1;
SELECT * FROM t1 ORDER BY id;
id	val
1	NULL
2	NULL
3	(-3.5,4.5)
4	(0,0)
5	(5,-6)
6	NULL
7	(-7.5,-8.5)
8	(0,0)
9	(9,10)
10	(0,0)
UPDATE t1 SET val = NULL WHERE id IN (3, 5, 7);
SELECT * FROM t1 ORDER BY id;
id	val
1	NULL
2	NULL
3	NULL
4	(0,0)
5	NULL
6	NULL
7	NULL
8	(0,0)
9	(9,10)
10	(0,0)
UPDATE t1 SET val = NULL WHERE val <= '(0,0)';
SELECT * FROM t1 ORDER BY id;
id	val
1	NULL
2	NULL
3	NULL
4	NULL
5	NULL
6	NULL
7	NULL
8	NULL
9	(9,10)
10	NULL
UPDATE t1 SET val = '(99.0,99.0)' WHERE id = 2;
SELECT * FROM t1 ORDER BY id;
id	val
1	NULL
2	(99,99)
3	NULL
4	NULL
5	NULL
6	NULL
7	NULL
8	NULL
9	(9,10)
10	NULL
UPDATE t1 SET val = '(-1.0,-1.0)' WHERE val IS NULL;
SELECT * FROM t1 ORDER BY id;
id	val
1	(-1,-1)
2	(99,99)
3	(-1,-1)
4	(-1,-1)
5	(-1,-1)
6	(-1,-1)
7	(-1,-1)
8	(-1,-1)
9	(9,10)
10	(-1,-1)
DROP TABLE t1;
