CREATE TABLE t1 (
id INT PRIMARY KEY,
val COMPLEX
);
INSERT INTO t1 VALUES
(1, '(1.0,2.0)'),
(2, '(0,0)'),
(3, '(-3.5,4.5)'),
(4, '(-0,0)'),
(5, '(5.0,-6.0)'),
(6, '(0,-0)'),
(7, '(-7.5,-8.5)'),
(8, '(-0,-0)'),
(9, '(9.0,10.0)'),
(10, '(0,0)');
SELECT * FROM t1 ORDER BY id;
id	val
1	(1,2)
2	(0,0)
3	(-3.5,4.5)
4	(0,0)
5	(5,-6)
6	(0,0)
7	(-7.5,-8.5)
8	(0,0)
9	(9,10)
10	(0,0)
WITH cte AS (
SELECT id FROM t1 WHERE id <= 3 ORDER BY id
)
DELETE FROM t1 WHERE id IN (SELECT id FROM cte);
SELECT * FROM t1 ORDER BY id;
id	val
4	(0,0)
5	(5,-6)
6	(0,0)
7	(-7.5,-8.5)
8	(0,0)
9	(9,10)
10	(0,0)
WITH cte AS (
SELECT id FROM t1 WHERE val = '(0,0)' ORDER BY id
)
DELETE FROM t1 WHERE id IN (SELECT id FROM cte);
SELECT * FROM t1 ORDER BY id;
id	val
5	(5,-6)
7	(-7.5,-8.5)
9	(9,10)
DROP TABLE t1;
