CREATE TABLE t1 (
id INT PRIMARY KEY,
val COMPLEX
);
INSERT INTO t1 VALUES
(1, '(1.0,2.0)'),
(2, '(0,0)'),
(3, '(-3.5,4.5)'),
(4, '(-0,0)'),
(5, '(5.0,-6.0)'),
(6, '(0,-0)'),
(7, '(-7.5,-8.5)'),
(8, '(-0,-0)'),
(9, '(9.0,10.0)'),
(10, '(0,0)');
SELECT * FROM t1 ORDER BY id;
id	val
1	(1,2)
2	(0,0)
3	(-3.5,4.5)
4	(0,0)
5	(5,-6)
6	(0,0)
7	(-7.5,-8.5)
8	(0,0)
9	(9,10)
10	(0,0)
DELETE FROM t1 WHERE val = '(1.0,2.0)';
SELECT * FROM t1 ORDER BY id;
id	val
2	(0,0)
3	(-3.5,4.5)
4	(0,0)
5	(5,-6)
6	(0,0)
7	(-7.5,-8.5)
8	(0,0)
9	(9,10)
10	(0,0)
DELETE FROM t1 WHERE val != '(0,0)';
SELECT * FROM t1 ORDER BY id;
id	val
2	(0,0)
4	(0,0)
6	(0,0)
8	(0,0)
10	(0,0)
DELETE FROM t1;
INSERT INTO t1 VALUES
(1, '(1.0,2.0)'),
(2, '(0,0)'),
(3, '(-3.5,4.5)'),
(4, '(-0,0)'),
(5, '(5.0,-6.0)');
DELETE FROM t1 WHERE val = '(0,0)';
SELECT * FROM t1 ORDER BY id;
id	val
1	(1,2)
3	(-3.5,4.5)
5	(5,-6)
DELETE FROM t1;
INSERT INTO t1 VALUES
(1, '(1.0,2.0)'),
(2, '(0,0)'),
(3, '(3.0,4.0)'),
(4, '(0,0)'),
(5, '(5.0,6.0)');
DELETE FROM t1 WHERE val IS NULL;
SELECT * FROM t1 ORDER BY id;
id	val
1	(1,2)
2	(0,0)
3	(3,4)
4	(0,0)
5	(5,6)
INSERT INTO t1 VALUES (6, NULL);
SELECT * FROM t1 ORDER BY id;
id	val
1	(1,2)
2	(0,0)
3	(3,4)
4	(0,0)
5	(5,6)
6	NULL
DELETE FROM t1 WHERE val IS NULL;
SELECT * FROM t1 ORDER BY id;
id	val
1	(1,2)
2	(0,0)
3	(3,4)
4	(0,0)
5	(5,6)
DROP TABLE t1;
