CREATE TABLE t1 (
id INT PRIMARY KEY,
val COMPLEX
);
CREATE TABLE t2 (
id INT PRIMARY KEY
);
INSERT INTO t1 VALUES
(1, '(1.0,2.0)'),
(2, '(0,0)'),
(3, '(-3.5,4.5)'),
(4, '(-0,0)'),
(5, '(5.0,-6.0)'),
(6, '(0,-0)'),
(7, '(-7.5,-8.5)'),
(8, '(-0,-0)'),
(9, '(9.0,10.0)'),
(10, '(0,0)');
INSERT INTO t2 VALUES (2), (4), (6), (8), (10);
SELECT * FROM t1 ORDER BY id;
id	val
1	(1,2)
2	(0,0)
3	(-3.5,4.5)
4	(0,0)
5	(5,-6)
6	(0,0)
7	(-7.5,-8.5)
8	(0,0)
9	(9,10)
10	(0,0)
SELECT * FROM t2 ORDER BY id;
id
2
4
6
8
10
DELETE FROM t1 USING t1, t2 WHERE t1.id = t2.id;
SELECT * FROM t1 ORDER BY id;
id	val
1	(1,2)
3	(-3.5,4.5)
5	(5,-6)
7	(-7.5,-8.5)
9	(9,10)
DROP TABLE t1;
DROP TABLE t2;
